{
  "schemaVersion": 1,
  "schema": "docs/ai-context-workspace-status.schema.json",
  "generatedBy": "ai-context-kit 0.3.58",
  "generatedAt": "2026-06-15T00:00:00.000Z",
  "workspace": ".",
  "workspaceName": "example-clean",
  "status": "ok",
  "alertCodes": [],
  "readiness": {
    "score": 92,
    "rawScore": 92,
    "maxScore": 100,
    "level": "ready",
    "summary": "92/100: Ready for routine agent handoff when task-specific source checks still run.",
    "factors": [
      {
        "id": "workflow",
        "label": "Context workflow files",
        "score": 20,
        "max": 20,
        "status": "ok",
        "evidence": [
          "AGENTS.md",
          "docs/ai-context-workspace-map.md"
        ],
        "missing": []
      },
      {
        "id": "audit",
        "label": "Drift audit",
        "score": 20,
        "max": 20,
        "status": "ok",
        "evidence": [
          "docs/ai-context-audit-state.json"
        ],
        "missing": []
      }
    ]
  },
  "token": {
    "status": "measured",
    "exists": true,
    "valid": true,
    "path": "docs/ai-context-token-status.json",
    "generatedAt": "2026-06-15T00:00:00.000Z",
    "staticContext": {
      "status": "measured",
      "report": "docs/ai-context-token-savings-measurement.md",
      "parentTokens": 100000,
      "routingTokens": 12000,
      "routingChangeFromParent": "节省 88.00%"
    },
    "hookObserve": {
      "status": "enabled",
      "events": 24
    }
  },
  "audit": {
    "status": "ok",
    "exists": true,
    "valid": true,
    "path": "docs/ai-context-audit-state.json",
    "alertCodes": [],
    "counts": {
      "contractDrifts": 0,
      "conflictObservations": 0,
      "unapprovedFieldMismatches": 0
    }
  },
  "quality": {
    "status": "ready",
    "exists": true,
    "path": "docs/ai-context-kit-real-task-ab-audit.md",
    "countedRecords": 3,
    "candidateRecords": 3,
    "supportingFiles": 0,
    "missingCategories": [],
    "processWarnings": 0
  },
  "reports": {
    "workspaceStatus": {
      "exists": true,
      "path": "docs/ai-context-workspace-status.json"
    },
    "tokenStatus": {
      "exists": true,
      "path": "docs/ai-context-token-status.json"
    },
    "auditState": {
      "exists": true,
      "path": "docs/ai-context-audit-state.json"
    },
    "realTaskAudit": {
      "exists": true,
      "path": "docs/ai-context-kit-real-task-ab-audit.md"
    }
  },
  "claims": {
    "staticContextSavings": {
      "status": "available",
      "source": "docs/ai-context-token-status.json"
    },
    "realTaskSavings": {
      "status": "available",
      "source": "docs/ai-context-kit-real-task-ab-audit.md"
    },
    "qualityPreservedTokenSavings": {
      "status": "available",
      "reasons": []
    }
  },
  "actions": []
}
